log_db_my_clip_unet/database_tuning_record.json
[0,[[[["GetBlock",[],["pad_temp","main"],["b0"]],["GetBlock",[],["conv2d_nchw","main"],["b1"]],["GetBlock",[],["T_add","main"],["b2"]],["GetBlock",[],["T_add_1","main"],["b3"]],["GetBlock",[],["root","main"],["b4"]],["Annotate",["b1","\"SSSRRSRS\""],["meta_schedule.tiling_structure"],[]],["GetLoops",["b1"],[],["l5","l6","l7","l8","l9","l10","l11"]],["SamplePerfectTile",["l5"],[5,64],["v12","v13","v14","v15","v16"]],["Split",["l5","v12","v13","v14","v15","v16"],[1],["l17","l18","l19","l20","l21"]],["SamplePerfectTile",["l6"],[5,64],["v22","v23","v24","v25","v26"]],["Split",["l6","v22","v23","v24","v25","v26"],[1],["l27","l28","l29","l30","l31"]],["SamplePerfectTile",["l7"],[5,64],["v32","v33","v34","v35","v36"]],["Split",["l7","v32","v33","v34","v35","v36"],[1],["l37","l38","l39","l40","l41"]],["SamplePerfectTile",["l8"],[5,64],["v42","v43","v44","v45","v46"]],["Split",["l8","v42","v43","v44","v45","v46"],[1],["l47","l48","l49","l50","l51"]],["SamplePerfectTile",["l9"],[3,64],["v52","v53","v54"]],["Split",["l9","v52","v53","v54"],[1],["l55","l56","l57"]],["SamplePerfectTile",["l10"],[3,64],["v58","v59","v60"]],["Split",["l10","v58","v59","v60"],[1],["l61","l62","l63"]],["SamplePerfectTile",["l11"],[3,64],["v64","v65","v66"]],["Split",["l11","v64","v65","v66"],[1],["l67","l68","l69"]],["Reorder",["l17","l27","l37","l47","l18","l28","l38","l48","l19","l29","l39","l49","l55","l61","l67","l56","l62","l68","l20","l30","l40","l50","l57","l63","l69","l21","l31","l41","l51"],[],[]],["Fuse",["l17","l27","l37","l47"],[1],["l70"]],["Bind",["l70"],["blockIdx.x"],[]],["Fuse",["l18","l28","l38","l48"],[1],["l71"]],["Bind",["l71"],["vthread.x"],[]],["Fuse",["l19","l29","l39","l49"],[1],["l72"]],["Bind",["l72"],["threadIdx.x"],[]],["Annotate",["b1",16],["meta_schedule.thread_extent_low_inclusive"],[]],["Annotate",["b1",1024],["meta_schedule.thread_extent_high_inclusive"],[]],["CacheWrite",["b1",[]],[0,"local"],["b73"]],["ReverseComputeAt",["b73","l72"],[1,-1],[]],["CacheRead",["b1",["b1"]],[0,"shared"],["b74"]],["ComputeAt",["b74","l67"],[1,-1],[]],["GetLoops",["b74"],[],["l75","l76","l77","l78","l79","l80","l81","l82","l83","l84"]],["Fuse",["l81","l82","l83","l84"],[1],["l85"]],["SampleCategorical",[],[[1,2,3,4],[0.25,0.25,0.25,0.25]],["v86"]],["Annotate",["b74","v86"],["meta_schedule.cooperative_fetch"],[]],["CacheRead",["b1",["b1"]],[1,"shared"],["b87"]],["ComputeAt",["b87","l67"],[1,-1],[]],["GetLoops",["b87"],[],["l88","l89","l90","l91","l92","l93","l94","l95","l96","l97"]],["Fuse",["l94","l95","l96","l97"],[1],["l98"]],["SampleCategorical",[],[[1,2,3,4],[0.25,0.25,0.25,0.25]],["v99"]],["Annotate",["b87","v99"],["meta_schedule.cooperative_fetch"],[]],["ReverseComputeInline",["b3"],[],[]],["ReverseComputeInline",["b2"],[],[]],["ComputeInline",["b0"],[],[]],["SampleCategorical",[],[[0,16,64,512,1024],[0.2000000000000000111,0.2000000000000000111,0.2000000000000000111,0.2000000000000000111,0.2000000000000000111]],["v100"]],["Annotate",["b4","v100"],["meta_schedule.unroll_explicit"],[]],["EnterPostproc",[],[],[]],["Unannotate",["b74"],["meta_schedule.cooperative_fetch"],[]],["GetLoops",["b74"],[],["l101","l102","l103","l104","l105","l106","l107"]],["Split",["l107","None",256,2],[1],["l108","l109","l110"]],["Vectorize",["l110"],[],[]],["Bind",["l109"],["threadIdx.x"],[]],["Unannotate",["b87"],["meta_schedule.cooperative_fetch"],[]],["GetLoops",["b87"],[],["l111","l112","l113","l114","l115","l116","l117"]],["Split",["l117","None",256,2],[1],["l118","l119","l120"]],["Vectorize",["l120"],[],[]],["Bind",["l119"],["threadIdx.x"],[]],["GetBlock",[],["root","main"],["b121"]],["Unannotate",["b121"],["meta_schedule.unroll_explicit"],[]],["GetChildBlocks",["b121"],[],["b122","b123","b124","b125"]],["GetLoops",["b122"],[],["l126","l127","l128","l129","l130","l131","l132","l133","l134"]],["GetLoops",["b123"],[],["l135","l136","l137","l138","l139","l140","l141","l142","l143"]],["GetLoops",["b124"],[],["l144","l145","l146","l147","l148","l149","l150","l151","l152","l153","l154","l155","l156","l157","l158","l159","l160","l161","l162","l163"]],["Annotate",["l144",64],["pragma_auto_unroll_max_step"],[]],["Annotate",["l144",1],["pragma_unroll_explicit"],[]],["GetLoops",["b125"],[],["l164","l165","l166","l167","l168","l169","l170"]],["GetBlock",[],["conv2d_nchw","main"],["b171"]],["GetLoops",["b171"],[],["l172","l173","l174","l175","l176","l177","l178","l179","l180","l181","l182","l183","l184","l185","l186","l187","l188","l189","l190","l191"]],["DecomposeReduction",["b171","l175"],[],["b192"]]],[[7,[2,1,1,1,1]],[9,[64,1,1,1,10]],[11,[2,1,8,1,2]],[13,[1,1,32,1,1]],[15,[384,5,1]],[17,[1,1,3]],[19,[1,1,3]],[36,1],[42,1],[47,2]]],[0.47520413200000000131],{"device":"mali","host":{"keys":["cpu"],"kind":"llvm","tag":""},"keys":["mali","opencl","gpu"],"kind":"opencl","max_function_args":128,"max_num_threads":1024,"max_shared_memory_per_block":32768,"max_threads_per_block":1024,"tag":"","texture_spatial_limit":16384,"thread_warp_size":16},[["TENSOR","float32",[2,1920,32,32]],["TENSOR","float32",[640,1920,3,3]],["TENSOR","float32",[1,640,1,1]],["TENSOR","float32",[2,640,1,1]],["TENSOR","float32",[2,640,32,32]]]]]
[1,[[[["GetBlock",[],["pad_temp","main"],["b0"]],["GetBlock",[],["conv2d_nchw","main"],["b1"]],["GetBlock",[],["T_add","main"],["b2"]],["GetBlock",[],["T_add_1","main"],["b3"]],["GetBlock",[],["root","main"],["b4"]],["Annotate",["b1","\"SSSRRSRS\""],["meta_schedule.tiling_structure"],[]],["GetLoops",["b1"],[],["l5","l6","l7","l8","l9","l10","l11"]],["SamplePerfectTile",["l5"],[5,64],["v12","v13","v14","v15","v16"]],["Split",["l5","v12","v13","v14","v15","v16"],[1],["l17","l18","l19","l20","l21"]],["SamplePerfectTile",["l6"],[5,64],["v22","v23","v24","v25","v26"]],["Split",["l6","v22","v23","v24","v25","v26"],[1],["l27","l28","l29","l30","l31"]],["SamplePerfectTile",["l7"],[5,64],["v32","v33","v34","v35","v36"]],["Split",["l7","v32","v33","v34","v35","v36"],[1],["l37","l38","l39","l40","l41"]],["SamplePerfectTile",["l8"],[5,64],["v42","v43","v44","v45","v46"]],["Split",["l8","v42","v43","v44","v45","v46"],[1],["l47","l48","l49","l50","l51"]],["SamplePerfectTile",["l9"],[3,64],["v52","v53","v54"]],["Split",["l9","v52","v53","v54"],[1],["l55","l56","l57"]],["SamplePerfectTile",["l10"],[3,64],["v58","v59","v60"]],["Split",["l10","v58","v59","v60"],[1],["l61","l62","l63"]],["SamplePerfectTile",["l11"],[3,64],["v64","v65","v66"]],["Split",["l11","v64","v65","v66"],[1],["l67","l68","l69"]],["Reorder",["l17","l27","l37","l47","l18","l28","l38","l48","l19","l29","l39","l49","l55","l61","l67","l56","l62","l68","l20","l30","l40","l50","l57","l63","l69","l21","l31","l41","l51"],[],[]],["Fuse",["l17","l27","l37","l47"],[1],["l70"]],["Bind",["l70"],["blockIdx.x"],[]],["Fuse",["l18","l28","l38","l48"],[1],["l71"]],["Bind",["l71"],["vthread.x"],[]],["Fuse",["l19","l29","l39","l49"],[1],["l72"]],["Bind",["l72"],["threadIdx.x"],[]],["Annotate",["b1",16],["meta_schedule.thread_extent_low_inclusive"],[]],["Annotate",["b1",1024],["meta_schedule.thread_extent_high_inclusive"],[]],["CacheWrite",["b1",[]],[0,"local"],["b73"]],["ReverseComputeAt",["b73","l72"],[1,-1],[]],["CacheRead",["b1",["b1"]],[0,"shared"],["b74"]],["ComputeAt",["b74","l67"],[1,-1],[]],["GetLoops",["b74"],[],["l75","l76","l77","l78","l79","l80","l81","l82","l83","l84"]],["Fuse",["l81","l82","l83","l84"],[1],["l85"]],["SampleCategorical",[],[[1,2,3,4],[0.25,0.25,0.25,0.25]],["v86"]],["Annotate",["b74","v86"],["meta_schedule.cooperative_fetch"],[]],["CacheRead",["b1",["b1"]],[1,"shared"],["b87"]],["ComputeAt",["b87","l67"],[1,-1],[]],["GetLoops",["b87"],[],["l88","l89","l90","l91","l92","l93","l94","l95","l96","l97"]],["Fuse",["l94","l95","l96","l97"],[1],["l98"]],["SampleCategorical",[],[[1,2,3,4],[0.25,0.25,0.25,0.25]],["v99"]],["Annotate",["b87","v99"],["meta_schedule.cooperative_fetch"],[]],["ReverseComputeInline",["b3"],[],[]],["ReverseComputeInline",["b2"],[],[]],["ComputeInline",["b0"],[],[]],["SampleCategorical",[],[[0,16,64,512,1024],[0.2000000000000000111,0.2000000000000000111,0.2000000000000000111,0.2000000000000000111,0.2000000000000000111]],["v100"]],["Annotate",["b4","v100"],["meta_schedule.unroll_explicit"],[]],["EnterPostproc",[],[],[]],["Unannotate",["b74"],["meta_schedule.cooperative_fetch"],[]],["GetLoops",["b74"],[],["l101","l102","l103","l104","l105","l106","l107"]],["Split",["l107","None",512],[1],["l108","l109"]],["Bind",["l109"],["threadIdx.x"],[]],["Unannotate",["b87"],["meta_schedule.cooperative_fetch"],[]],["GetLoops",["b87"],[],["l110","l111","l112","l113","l114","l115","l116"]],["Split",["l116","None",512,3],[1],["l117","l118","l119"]],["Vectorize",["l119"],[],[]],["Bind",["l118"],["threadIdx.x"],[]],["GetBlock",[],["root","main"],["b120"]],["Unannotate",["b120"],["meta_schedule.unroll_explicit"],[]],["GetChildBlocks",["b120"],[],["b121","b122","b123","b124"]],["GetLoops",["b121"],[],["l125","l126","l127","l128","l129","l130","l131","l132"]],["GetLoops",["b122"],[],["l133","l134","l135","l136","l137","l138","l139","l140","l141"]],["GetLoops",["b123"],[],["l142","l143","l144","l145","l146","l147","l148","l149","l150","l151","l152","l153","l154","l155","l156","l157","l158","l159","l160","l161"]],["Annotate",["l142",64],["pragma_auto_unroll_max_step"],[]],["Annotate",["l142",1],["pragma_unroll_explicit"],[]],["GetLoops",["b124"],[],["l162","l163","l164","l165","l166","l167","l168"]],["GetBlock",[],["conv2d_nchw","main"],["b169"]],["GetLoops",["b169"],[],["l170","l171","l172","l173","l174","l175","l176","l177","l178","l179","l180","l181","l182","l183","l184","l185","l186","l187","l188","l189"]],["DecomposeReduction",["b169","l173"],[],["b190"]]],[[7,[1,1,2,1,1]],[9,[5,1,16,4,1]],[11,[64,1,1,1,1]],[13,[1,1,16,2,2]],[15,[960,1,1]],[17,[1,3,1]],[19,[1,1,3]],[36,0],[42,2],[47,2]]],[0.37056521900000000125],{"device":"mali","host":{"keys":["cpu"],"kind":"llvm","tag":""},"keys":["mali","opencl","gpu"],"kind":"opencl","max_function_args":128,"max_num_threads":1024,"max_shared_memory_per_block":32768,"max_threads_per_block":1024,"tag":"","texture_spatial_limit":16384,"thread_warp_size":16},[["TENSOR","float32",[2,960,64,64]],["TENSOR","float32",[320,960,3,3]],["TENSOR","float32",[1,320,1,1]],["TENSOR","float32",[2,320,1,1]],["TENSOR","float32",[2,320,64,64]]]]]
[2,[[[["GetBlock",[],["pad_temp","main"],["b0"]],["GetBlock",[],["conv2d_nchw","main"],["b1"]],["GetBlock",[],["T_add","main"],["b2"]],["GetBlock",[],["T_add_1","main"],["b3"]],["GetBlock",[],["root","main"],["b4"]],["Annotate",["b1","\"SSSRRSRS\""],["meta_schedule.tiling_structure"],[]],["GetLoops",["b1"],[],["l5","l6","l7","l8","l9","l10","l11"]],["SamplePerfectTile",["l5"],[5,64],["v12","v13","v14","v15","v16"]],["Split",["l5","v12","v13","v14","v15","v16"],[1],["l17","l18","l19","l20","l21"]],["SamplePerfectTile",["l6"],[5,64],["v22","v23","v24","v25","v26"]],["Split",["l6","v22","v23","v24","v25","v26"],[1],["l27","l28","l29","l30","l31"]],["SamplePerfectTile",["l7"],[5,64],["v32","v33","v34","v35","v36"]],["Split",["l7","v32","v33","v34","v35","v36"],[1],["l37","l38","l39","l40","l41"]],["SamplePerfectTile",["l8"],[5,64],["v42","v43","v44","v45","v46"]],["Split",["l8","v42","v43","v44","v45","v46"],[1],["l47","l48","l49","l50","l51"]],["SamplePerfectTile",["l9"],[3,64],["v52","v53","v54"]],["Split",["l9","v52","v53","v54"],[1],["l55","l56","l57"]],["SamplePerfectTile",["l10"],[3,64],["v58","v59","v60"]],["Split",["l10","v58","v59","v60"],[1],["l61","l62","l63"]],["SamplePerfectTile",["l11"],[3,64],["v64","v65","v66"]],["Split",["l11","v64","v65","v66"],[1],["l67","l68","l69"]],["Reorder",["l17","l27","l37","l47","l18","l28","l38","l48","l19","l29","l39","l49","l55","l61","l67","l56","l62","l68","l20","l30","l40","l50","l57","l63","l69","l21","l31","l41","l51"],[],[]],["Fuse",["l17","l27","l37","l47"],[1],["l70"]],["Bind",["l70"],["blockIdx.x"],[]],["Fuse",["l18","l28","l38","l48"],[1],["l71"]],["Bind",["l71"],["vthread.x"],[]],["Fuse",["l19","l29","l39","l49"],[1],["l72"]],["Bind",["l72"],["threadIdx.x"],[]],["Annotate",["b1",16],["meta_schedule.thread_extent_low_inclusive"],[]],["Annotate",["b1",1024],["meta_schedule.thread_extent_high_inclusive"],[]],["CacheWrite",["b1",[]],[0,"local"],["b73"]],["ReverseComputeAt",["b73","l72"],[1,-1],[]],["CacheRead",["b1",["b1"]],[0,"shared"],["b74"]],["ComputeAt",["b74","l67"],[1,-1],[]],["GetLoops",["b74"],[],["l75","l76","l77","l78","l79","l80","l81","l82","l83","l84"]],["Fuse",["l81","l82","l83","l84"],[1],["l85"]],["SampleCategorical",[],[[1,2,3,4],[0.25,0.25,0.25,0.25]],["v86"]],["Annotate",["b74","v86"],["meta_schedule.cooperative_fetch"],[]],["CacheRead",["b1",["b1"]],[1,"shared"],["b87"]],["ComputeAt",["b87","l67"],[1,-1],[]],["GetLoops",["b87"],[],["l88","l89","l90","l91","l92","l93","l94","l95","l96","l97"]],["Fuse",["l94","l95","l96","l97"],[1],["l98"]],["SampleCategorical",[],[[1,2,3,4],[0.25,0.25,0.25,0.25]],["v99"]],["Annotate",["b87","v99"],["meta_schedule.cooperative_fetch"],[]],["ReverseComputeInline",["b3"],[],[]],["ReverseComputeInline",["b2"],[],[]],["ComputeInline",["b0"],[],[]],["SampleCategorical",[],[[0,16,64,512,1024],[0.2000000000000000111,0.2000000000000000111,0.2000000000000000111,0.2000000000000000111,0.2000000000000000111]],["v100"]],["Annotate",["b4","v100"],["meta_schedule.unroll_explicit"],[]],["EnterPostproc",[],[],[]],["Unannotate",["b74"],["meta_schedule.cooperative_fetch"],[]],["GetLoops",["b74"],[],["l101","l102","l103","l104","l105","l106","l107"]],["Split",["l107","None",64,2],[1],["l108","l109","l110"]],["Vectorize",["l110"],[],[]],["Bind",["l109"],["threadIdx.x"],[]],["Unannotate",["b87"],["meta_schedule.cooperative_fetch"],[]],["GetLoops",["b87"],[],["l111","l112","l113","l114","l115","l116","l117"]],["Split",["l117","None",64,2],[1],["l118","l119","l120"]],["Vectorize",["l120"],[],[]],["Bind",["l119"],["threadIdx.x"],[]],["GetBlock",[],["root","main"],["b121"]],["Unannotate",["b121"],["meta_schedule.unroll_explicit"],[]],["GetChildBlocks",["b121"],[],["b122","b123","b124","b125"]],["GetLoops",["b122"],[],["l126","l127","l128","l129","l130","l131","l132","l133","l134"]],["GetLoops",["b123"],[],["l135","l136","l137","l138","l139","l140","l141","l142","l143"]],["GetLoops",["b124"],[],["l144","l145","l146","l147","l148","l149","l150","l151","l152","l153","l154","l155","l156","l157","l158","l159","l160","l161","l162","l163"]],["Annotate",["l144",16],["pragma_auto_unroll_max_step"],[]],["Annotate",["l144",1],["pragma_unroll_explicit"],[]],["GetLoops",["b125"],[],["l164","l165","l166","l167","l168","l169","l170"]],["GetBlock",[],["conv2d_nchw","main"],["b171"]],["GetLoops",["b171"],[],["l172","l173","l174","l175","l176","l177","l178","l179","l180","l181","l182","l183","l184","l185","l186","l187","l188","l189","l190","l191"]],["DecomposeReduction",["b171","l175"],[],["b192"]]],[[7,[2,1,1,1,1]],[9,[80,1,1,8,1]],[11,[1,1,16,2,1]],[13,[8,1,4,1,1]],[15,[1280,1,1]],[17,[1,3,1]],[19,[1,3,1]],[36,1],[42,1],[47,1]]],[0.36864121499999996656],{"device":"mali","host":{"keys":["cpu"],"kind":"llvm","tag":""},"keys":["mali","opencl","gpu"],"kind":"opencl","max_function_args":128,"max_num_threads":1024,"max_shared_memory_per_block":32768,"max_threads_per_block":1024,"tag":"","texture_spatial_limit":16384,"thread_warp_size":16},[["TENSOR","float32",[2,1280,32,32]],["TENSOR","float32",[640,1280,3,3]],["TENSOR","float32",[1,640,1,1]],["TENSOR","float32",[2,640,1,1]],["TENSOR","float32",[2,640,32,32]]]]]
[3,[[[["GetBlock",[],["pad_temp","main"],["b0"]],["GetBlock",[],["conv2d_nchw","main"],["b1"]],["GetBlock",[],["T_add","main"],["b2"]],["GetBlock",[],["T_add_1","main"],["b3"]],["GetBlock",[],["root","main"],["b4"]],["Annotate",["b1","\"SSSRRSRS\""],["meta_schedule.tiling_structure"],[]],["GetLoops",["b1"],[],["l5","l6","l7","l8","l9","l10","l11"]],["SamplePerfectTile",["l5"],[5,64],["v12","v13","v14","v15","v16"]],["Split",["l5","v12","v13","v14","v15","v16"],[1],["l17","l18","l19","l20","l21"]],["SamplePerfectTile",["l6"],[5,64],["v22","v23","v24","v25","v26"]],["Split",["l6","v22","v23","v24","v25","v26"],[1],["l27","l28","l29","l30","l31"]],["SamplePerfectTile",["l7"],[5,64],["v32","v33","v34","v35","v36"]],["Split",["l7","v32","v33","v34","v35","v36"],[1],["l37","l38","l39","l40","l41"]],["SamplePerfectTile",["l8"],[5,64],["v42","v43","v44","v45","v46"]],["Split",["l8","v42","v43","v44","v45","v46"],[1],["l47","l48","l49","l50","l51"]],["SamplePerfectTile",["l9"],[3,64],["v52","v53","v54"]],["Split",["l9","v52","v53","v54"],[1],["l55","l56","l57"]],["SamplePerfectTile",["l10"],[3,64],["v58","v59","v60"]],["Split",["l10","v58","v59","v60"],[1],["l61","l62","l63"]],["SamplePerfectTile",["l11"],[3,64],["v64","v65","v66"]],["Split",["l11","v64","v65","v66"],[1],["l67","l68","l69"]],["Reorder",["l17","l27","l37","l47","l18","l28","l38","l48","l19","l29","l39","l49","l55","l61","l67","l56","l62","l68","l20","l30","l40","l50","l57","l63","l69","l21","l31","l41","l51"],[],[]],["Fuse",["l17","l27","l37","l47"],[1],["l70"]],["Bind",["l70"],["blockIdx.x"],[]],["Fuse",["l18","l28","l38","l48"],[1],["l71"]],["Bind",["l71"],["vthread.x"],[]],["Fuse",["l19","l29","l39","l49"],[1],["l72"]],["Bind",["l72"],["threadIdx.x"],[]],["Annotate",["b1",16],["meta_schedule.thread_extent_low_inclusive"],[]],["Annotate",["b1",1024],["meta_schedule.thread_extent_high_inclusive"],[]],["CacheWrite",["b1",[]],[0,"local"],["b73"]],["ReverseComputeAt",["b73","l72"],[1,-1],[]],["CacheRead",["b1",["b1"]],[0,"shared"],["b74"]],["ComputeAt",["b74","l67"],[1,-1],[]],["GetLoops",["b74"],[],["l75","l76","l77","l78","l79","l80","l81","l82","l83","l84"]],["Fuse",["l81","l82","l83","l84"],[1],["l85"]],["SampleCategorical",[],[[1,2,3,4],[0.25,0.25,0.25,0.25]],["v86"]],["Annotate",["b74","v86"],["meta_schedule.cooperative_fetch"],[]],["CacheRead",["b1",["b1"]],[1,"shared"],["b87"]],["ComputeAt",["b87","l67"],[1,-1],[]],["GetLoops",["b87"],[],["l88","l89","l90","l91","l92","l93","l94","l95","l96","l97"]],["Fuse",["l94","l95","l96","l97"],[1],["l98"]],["SampleCategorical",[],[[1,2,3,4],[0.25,0.25,0.25,0.25]],["v99"]],["Annotate",["b87","v99"],["meta_schedule.cooperative_fetch"],[]],["ReverseComputeInline",["b3"],[],[]],["ReverseComputeInline",["b2"],[],[]],["ComputeInline",["b0"],[],[]],["SampleCategorical",[],[[0,16,64,512,1024],[0.2000000000000000111,0.2000000000000000111,0.2000000000000000111,0.2000000000000000111,0.2000000000000000111]],["v100"]],["Annotate",["b4","v100"],["meta_schedule.unroll_explicit"],[]],["EnterPostproc",[],[],[]],["Unannotate",["b74"],["meta_schedule.cooperative_fetch"],[]],["GetLoops",["b74"],[],["l101","l102","l103","l104","l105","l106","l107"]],["Split",["l107","None",128,4],[1],["l108","l109","l110"]],["Vectorize",["l110"],[],[]],["Bind",["l109"],["threadIdx.x"],[]],["Unannotate",["b87"],["meta_schedule.cooperative_fetch"],[]],["GetLoops",["b87"],[],["l111","l112","l113","l114","l115","l116","l117"]],["Split",["l117","None",128,2],[1],["l118","l119","l120"]],["Vectorize",["l120"],[],[]],["Bind",["l119"],["threadIdx.x"],[]],["GetBlock",[],["root","main"],["b121"]],["Unannotate",["b121"],["meta_schedule.unroll_explicit"],[]],["GetChildBlocks",["b121"],[],["b122","b123","b124","b125"]],["GetLoops",["b122"],[],["l126","l127","l128","l129","l130","l131","l132","l133","l134"]],["GetLoops",["b123"],[],["l135","l136","l137","l138","l139","l140","l141","l142","l143"]],["GetLoops",["b124"],[],["l144","l145","l146","l147","l148","l149","l150","l151","l152","l153","l154","l155","l156","l157","l158","l159","l160","l161","l162","l163"]],["Annotate",["l144",64],["pragma_auto_unroll_max_step"],[]],["Annotate",["l144",1],["pragma_unroll_explicit"],[]],["GetLoops",["b125"],[],["l164","l165","l166","l167","l168","l169","l170"]],["GetBlock",[],["conv2d_nchw","main"],["b171"]],["GetLoops",["b171"],[],["l172","l173","l174","l175","l176","l177","l178","l179","l180","l181","l182","l183","l184","l185","l186","l187","l188","l189","l190","l191"]],["DecomposeReduction",["b171","l175"],[],["b192"]]],[[7,[1,1,1,2,1]],[9,[80,2,8,1,1]],[11,[4,1,4,1,1]],[13,[1,1,4,2,2]],[15,[240,8,1]],[17,[1,1,3]],[19,[3,1,1]],[36,3],[42,1],[47,2]]],[0.34456079899999997318],{"device":"mali","host":{"keys":["cpu"],"kind":"llvm","tag":""},"keys":["mali","opencl","gpu"],"kind":"opencl","max_function_args":128,"max_num_threads":1024,"max_shared_memory_per_block":32768,"max_threads_per_block":1024,"tag":"","texture_spatial_limit":16384,"thread_warp_size":16},[["TENSOR","float32",[2,1920,16,16]],["TENSOR","float32",[1280,1920,3,3]],["TENSOR","float32",[1,1280,1,1]],["TENSOR","float32",[2,1280,1,1]],["TENSOR","float32",[2,1280,16,16]]]]]
[4,[[[["GetBlock",[],["pad_temp","main"],["b0"]],["GetBlock",[],["conv2d_nchw","main"],["b1"]],["GetBlock",[],["T_add","main"],["b2"]],["GetBlock",[],["T_add_1","main"],["b3"]],["GetBlock",[],["root","main"],["b4"]],["Annotate",["b1","\"SSSRRSRS\""],["meta_schedule.tiling_structure"],[]],["GetLoops",["b1"],[],["l5","l6","l7","l8","l9","l10","l11"]],["SamplePerfectTile",["l5"],[5,64],["v12","v13","v14","v15","v16"]],["Split",["l5","v12","v13","v14","v15","v16"],[1],["l17","l18","l19","l20","l21"]],["SamplePerfectTile",["l6"],[5,64],["v22","v23","v24","v25","v26"]],["Split",["l6","v22","v23","v24","v25","v26"],[1],["l27","l28","l29","l30","l31"]],["SamplePerfectTile",["l7"],[5,64],["v32","v33","v34","v35","v36"]],["Split",["l7","v32","v33","v34","v35","v36"],[1],["l37","l38","l39","l40","l41"]],["SamplePerfectTile",["l8"],[5,64],["v42","v43","v44","v45","v46"]],["Split",["l8","v42","v43","v44","v45","v46"],[1],["l47","l48","l49","l50","l51"]],["SamplePerfectTile",["l9"],[3,64],["v52","v53","v54"]],["Split",["l9","v52","v53","v54"],[1],["l55","l56","l57"]],["SamplePerfectTile",["l10"],[3,64],["v58","v59","v60"]],["Split",["l10","v58","v59","v60"],[1],["l61","l62","l63"]],["SamplePerfectTile",["l11"],[3,64],["v64","v65","v66"]],["Split",["l11","v64","v65","v66"],[1],["l67","l68","l69"]],["Reorder",["l17","l27","l37","l47","l18","l28","l38","l48","l19","l29","l39","l49","l55","l61","l67","l56","l62","l68","l20","l30","l40","l50","l57","l63","l69","l21","l31","l41","l51"],[],[]],["Fuse",["l17","l27","l37","l47"],[1],["l70"]],["Bind",["l70"],["blockIdx.x"],[]],["Fuse",["l18","l28","l38","l48"],[1],["l71"]],["Bind",["l71"],["vthread.x"],[]],["Fuse",["l19","l29","l39","l49"],[1],["l72"]],["Bind",["l72"],["threadIdx.x"],[]],["Annotate",["b1",16],["meta_schedule.thread_extent_low_inclusive"],[]],["Annotate",["b1",1024],["meta_schedule.thread_extent_high_inclusive"],[]],["CacheWrite",["b1",[]],[0,"local"],["b73"]],["ReverseComputeAt",["b73","l72"],[1,-1],[]],["CacheRead",["b1",["b1"]],[0,"shared"],["b74"]],["ComputeAt",["b74","l67"],[1,-1],[]],["GetLoops",["b74"],[],["l75","l76","l77","l78","l79","l80","l81","l82","l83","l84"]],["Fuse",["l81","l82","l83","l84"],[1],["l85"]],["SampleCategorical",[],[[1,2,3,4],[0.25,0.25,0.25,0.25]],["v86"]],["Annotate",["b74","v86"],["meta_schedule.cooperative_fetch"],[]],["CacheRead",["b1",["b1"]],[1,"shared"],["b87"]],["ComputeAt",["b87","l67"],[1,-1],[]],["GetLoops",["b87"],[],["l88","l89","l90","l91","l92","l93","l94","l95","l96","l97"]],["Fuse",["l94","l95","l96","l97"],[1],["l98"]],["SampleCategorical",[],[[1,2,3,4],[0.25,0.25,0.25,0.25]],["v99"]],["Annotate",["b87","v99"],["meta_schedule.cooperative_fetch"],[]],["ReverseComputeInline",["b3"],[],[]],["ReverseComputeInline",["b2"],[],[]],["ComputeInline",["b0"],[],[]],["SampleCategorical",[],[[0,16,64,512,1024],[0.2000000000000000111,0.2000000000000000111,0.2000000000000000111,0.2000000000000000111,0.2000000000000000111]],["v100"]],["Annotate",["b4","v100"],["meta_schedule.unroll_explicit"],[]],["EnterPostproc",[],[],[]],["Unannotate",["b74"],["meta_schedule.cooperative_fetch"],[]],["GetLoops",["b74"],[],["l101","l102","l103","l104","l105","l106","l107"]],["Split",["l107","None",128,3],[1],["l108","l109","l110"]],["Vectorize",["l110"],[],[]],["Bind",["l109"],["threadIdx.x"],[]],["Unannotate",["b87"],["meta_schedule.cooperative_fetch"],[]],["GetLoops",["b87"],[],["l111","l112","l113","l114","l115","l116","l117"]],["Split",["l117","None",128,3],[1],["l118","l119","l120"]],["Vectorize",["l120"],[],[]],["Bind",["l119"],["threadIdx.x"],[]],["GetBlock",[],["root","main"],["b121"]],["Unannotate",["b121"],["meta_schedule.unroll_explicit"],[]],["GetChildBlocks",["b121"],[],["b122","b123","b124","b125"]],["GetLoops",["b122"],[],["l126","l127","l128","l129","l130","l131","l132","l133","l134"]],["GetLoops",["b123"],[],["l135","l136","l137","l138","l139","l140","l141","l142","l143"]],["GetLoops",["b124"],[],["l144","l145","l146","l147","l148","l149","l150","l151","l152","l153","l154","l155","l156","l157","l158","l159","l160","l161","l162","l163"]],["Annotate",["l144",64],["pragma_auto_unroll_max_step"],[]],["Annotate",["l144",1],["pragma_unroll_explicit"],[]],["GetLoops",["b125"],[],["l164","l165","l166","l167","l168","l169","l170"]],["GetBlock",[],["conv2d_nchw","main"],["b171"]],["GetLoops",["b171"],[],["l172","l173","l174","l175","l176","l177","l178","l179","l180","l181","l182","l183","l184","l185","l186","l187","l188","l189","l190","l191"]],["DecomposeReduction",["b171","l175"],[],["b192"]]],[[7,[2,1,1,1,1]],[9,[160,2,4,1,1]],[11,[1,1,8,1,2]],[13,[1,1,4,4,1]],[15,[640,4,1]],[17,[1,3,1]],[19,[1,3,1]],[36,2],[42,2],[47,2]]],[0.2939221690000000109],{"device":"mali","host":{"keys":["cpu"],"kind":"llvm","tag":""},"keys":["mali","opencl","gpu"],"kind":"opencl","max_function_args":128,"max_num_threads":1024,"max_shared_memory_per_block":32768,"max_threads_per_block":1024,"tag":"","texture_spatial_limit":16384,"thread_warp_size":16},[["TENSOR","float32",[2,2560,16,16]],["TENSOR","float32",[1280,2560,3,3]],["TENSOR","float32",[1,1280,1,1]],["TENSOR","float32",[2,1280,1,1]],["TENSOR","float32",[2,1280,16,16]]]]]
[5,[[[["GetBlock",[],["pad_temp","main"],["b0"]],["GetBlock",[],["conv2d_nchw","main"],["b1"]],["GetBlock",[],["T_add","main"],["b2"]],["GetBlock",[],["T_add_1","main"],["b3"]],["GetBlock",[],["root","main"],["b4"]],["Annotate",["b1","\"SSSRRSRS\""],["meta_schedule.tiling_structure"],[]],["GetLoops",["b1"],[],["l5","l6","l7","l8","l9","l10","l11"]],["SamplePerfectTile",["l5"],[5,64],["v12","v13","v14","v15","v16"]],["Split",["l5","v12","v13","v14","v15","v16"],[1],["l17","l18","l19","l20","l21"]],["SamplePerfectTile",["l6"],[5,64],["v22","v23","v24","v25","v26"]],["Split",["l6","v22","v23","v24","v25","v26"],[1],["l27","l28","l29","l30","l31"]],["SamplePerfectTile",["l7"],[5,64],["v32","v33","v34","v35","v36"]],["Split",["l7","v32","v33","v34","v35","v36"],[1],["l37","l38","l39","l40","l41"]],["SamplePerfectTile",["l8"],[5,64],["v42","v43","v44","v45","v46"]],["Split",["l8","v42","v43","v44","v45","v46"],[1],["l47","l48","l49","l50","l51"]],["SamplePerfectTile",["l9"],[3,64],["v52","v53","v54"]],["Split",["l9","v52","v53","v54"],[1],["l55","l56","l57"]],["SamplePerfectTile",["l10"],[3,64],["v58","v59","v60"]],["Split",["l10","v58","v59","v60"],[1],["l61","l62","l63"]],["SamplePerfectTile",["l11"],[3,64],["v64","v65","v66"]],["Split",["l11","v64","v65","v66"],[1],["l67","l68","l69"]],["Reorder",["l17","l27","l37","l47","l18","l28","l38","l48","l19","l29","l39","l49","l55","l61","l67","l56","l62","l68","l20","l30","l40","l50","l57","l63","l69","l21","l31","l41","l51"],[],[]],["Fuse",["l17","l27","l37","l47"],[1],["l70"]],["Bind",["l70"],["blockIdx.x"],[]],["Fuse",["l18","l28","l38","l48"],[1],["l71"]],["Bind",["l71"],["vthread.x"],[]],["Fuse",["l19","l29","l39","l49"],[1],["l72"]],["Bind",["l72"],["threadIdx.x"],[]],["Annotate",["b1",16],["meta_schedule.thread_extent_low_inclusive"],[]],["Annotate",["b1",1024],["meta_schedule.thread_extent_high_inclusive"],[]],["CacheWrite",["b1",[]],[0,"local"],["b73"]],["ReverseComputeAt",["b73","l72"],[1,-1],[]],["CacheRead",["b1",["b1"]],[0,"shared"],["b74"]],["ComputeAt",["b74","l67"],[1,-1],[]],["GetLoops",["b74"],[],["l75","l76","l77","l78","l79","l80","l81","l82","l83","l84"]],["Fuse",["l81","l82","l83","l84"],[1],["l85"]],["SampleCategorical",[],[[1,2,3,4],[0.25,0.25,0.25,0.25]],["v86"]],["Annotate",["b74","v86"],["meta_schedule.cooperative_fetch"],[]],["CacheRead",["b1",["b1"]],[1,"shared"],["b87"]],["ComputeAt",["b87","l67"],[1,-1],[]],["GetLoops",["b87"],[],["l88","l89","l90","l91","l92","l93","l94","l95","l96","l97"]],["Fuse",["l94","l95","l96","l97"],[1],["l98"]],["SampleCategorical",[],[[1,2,3,4],[0.25,0.25,0.25,0.25]],["v99"]],["Annotate",["b87","v99"],["meta_schedule.cooperative_fetch"],[]],["ReverseComputeInline",["b3"],[],[]],["ReverseComputeInline",["b2"],[],[]],["ComputeInline",["b0"],[],[]],["SampleCategorical",[],[[0,16,64,512,1024],[0.2000000000000000111,0.2000000000000000111,0.2000000000000000111,0.2000000000000000111,0.2000000000000000111]],["v100"]],["Annotate",["b4","v100"],["meta_schedule.unroll_explicit"],[]],["EnterPostproc",[],[],[]],["Unannotate",["b74"],["meta_schedule.cooperative_fetch"],[]],["GetLoops",["b74"],[],["l101","l102","l103","l104","l105","l106","l107"]],["Split",["l107","None",64],[1],["l108","l109"]],["Bind",["l109"],["threadIdx.x"],[]],["Unannotate",["b87"],["meta_schedule.cooperative_fetch"],[]],["GetLoops",["b87"],[],["l110","l111","l112","l113","l114","l115","l116"]],["Split",["l116","None",64,3],[1],["l117","l118","l119"]],["Vectorize",["l119"],[],[]],["Bind",["l118"],["threadIdx.x"],[]],["GetBlock",[],["root","main"],["b120"]],["Unannotate",["b120"],["meta_schedule.unroll_explicit"],[]],["GetChildBlocks",["b120"],[],["b121","b122","b123","b124"]],["GetLoops",["b121"],[],["l125","l126","l127","l128","l129","l130","l131","l132"]],["GetLoops",["b122"],[],["l133","l134","l135","l136","l137","l138","l139","l140","l141"]],["GetLoops",["b123"],[],["l142","l143","l144","l145","l146","l147","l148","l149","l150","l151","l152","l153","l154","l155","l156","l157","l158","l159","l160","l161"]],["Annotate",["l142",512],["pragma_auto_unroll_max_step"],[]],["Annotate",["l142",1],["pragma_unroll_explicit"],[]],["GetLoops",["b124"],[],["l162","l163","l164","l165","l166","l167","l168"]],["GetBlock",[],["conv2d_nchw","main"],["b169"]],["GetLoops",["b169"],[],["l170","l171","l172","l173","l174","l175","l176","l177","l178","l179","l180","l181","l182","l183","l184","l185","l186","l187","l188","l189"]],["DecomposeReduction",["b169","l173"],[],["b190"]]],[[7,[1,1,1,2,1]],[9,[10,1,32,1,1]],[11,[8,1,1,8,1]],[13,[16,1,2,2,1]],[15,[64,10,1]],[17,[1,1,3]],[19,[1,3,1]],[36,0],[42,2],[47,3]]],[0.24039288500000000059],{"device":"mali","host":{"keys":["cpu"],"kind":"llvm","tag":""},"keys":["mali","opencl","gpu"],"kind":"opencl","max_function_args":128,"max_num_threads":1024,"max_shared_memory_per_block":32768,"max_threads_per_block":1024,"tag":"","texture_spatial_limit":16384,"thread_warp_size":16},[["TENSOR","float32",[2,640,64,64]],["TENSOR","float32",[320,640,3,3]],["TENSOR","float32",[1,320,1,1]],["TENSOR","float32",[2,320,1,1]],["TENSOR","float32",[2,320,64,64]]]]]
[6,[[[["GetBlock",[],["pad_temp","main"],["b0"]],["GetBlock",[],["conv2d_nchw","main"],["b1"]],["GetBlock",[],["T_add","main"],["b2"]],["GetBlock",[],["T_add_1","main"],["b3"]],["GetBlock",[],["root","main"],["b4"]],["Annotate",["b1","\"SSSRRSRS\""],["meta_schedule.tiling_structure"],[]],["GetLoops",["b1"],[],["l5","l6","l7","l8","l9","l10","l11"]],["SamplePerfectTile",["l5"],[5,64],["v12","v13","v14","v15","v16"]],["Split",["l5","v12","v13","v14","v15","v16"],[1],["l17","l18","l19","l20","l21"]],["SamplePerfectTile",["l6"],[5,64],["v22","v23","v24","v25","v26"]],["Split",["l6","v22","v23","v24","v25","v26"],[1],["l27","l28","l29","l30","l31"]],["SamplePerfectTile",["l7"],[5,64],["v32","v33","v34","v35","v36"]],["Split",["l7","v32","v33","v34","v35","v36"],[1],["l37","l38","l39","l40","l41"]],["SamplePerfectTile",["l8"],[5,64],["v42","v43","v44","v45","v46"]],["Split",["l8","v42","v43","v44","v45","v46"],[1],["l47","l48","l49","l50","l51"]],["SamplePerfectTile",["l9"],[3,64],["v52","v53","v54"]],["Split",["l9","v52","v53","v54"],[1],["l55","l56","l57"]],["SamplePerfectTile",["l10"],[3,64],["v58","v59","v60"]],["Split",["l10","v58","v59","v60"],[1],["l61","l62","l63"]],["SamplePerfectTile",["l11"],[3,64],["v64","v65","v66"]],["Split",["l11","v64","v65","v66"],[1],["l67","l68","l69"]],["Reorder",["l17","l27","l37","l47","l18","l28","l38","l48","l19","l29","l39","l49","l55","l61","l67","l56","l62","l68","l20","l30","l40","l50","l57","l63","l69","l21","l31","l41","l51"],[],[]],["Fuse",["l17","l27","l37","l47"],[1],["l70"]],["Bind",["l70"],["blockIdx.x"],[]],["Fuse",["l18","l28","l38","l48"],[1],["l71"]],["Bind",["l71"],["vthread.x"],[]],["Fuse",["l19","l29","l39","l49"],[1],["l72"]],["Bind",["l72"],["threadIdx.x"],[]],["Annotate",["b1",16],["meta_schedule.thread_extent_low_inclusive"],[]],["Annotate",["b1",1024],["meta_schedule.thread_extent_high_inclusive"],[]],["CacheWrite",["b1",[]],[0,"local"],["b73"]],["ReverseComputeAt",["b73","l72"],[1,-1],[]],["CacheRead",["b1",["b1"]],[0,"shared"],["b74"]],["ComputeAt",["b74","l67"],[1,-1],[]],["GetLoops",["b74"],[],["l75","l76","l77","l78","l79","l80","l81","l82","l83","l84"]],["Fuse",["l81","l82","l83","l84"],[1],["l85"]],["SampleCategorical",[],[[1,2,3,4],[0.25,0.25,0.25,0.25]],["v86"]],["Annotate",["b74","v86"],["meta_schedule.cooperative_fetch"],[]],["CacheRead",["b1",["b1"]],[1,"shared"],["b87"]],["ComputeAt",["b87","l67"],[1,-1],[]],["GetLoops",["b87"],[],["l88","l89","l90","l91","l92","l93","l94","l95","l96","l97"]],["Fuse",["l94","l95","l96","l97"],[1],["l98"]],["SampleCategorical",[],[[1,2,3,4],[0.25,0.25,0.25,0.25]],["v99"]],["Annotate",["b87","v99"],["meta_schedule.cooperative_fetch"],[]],["ReverseComputeInline",["b3"],[],[]],["ReverseComputeInline",["b2"],[],[]],["ComputeInline",["b0"],[],[]],["SampleCategorical",[],[[0,16,64,512,1024],[0.2000000000000000111,0.2000000000000000111,0.2000000000000000111,0.2000000000000000111,0.2000000000000000111]],["v100"]],["Annotate",["b4","v100"],["meta_schedule.unroll_explicit"],[]],["EnterPostproc",[],[],[]],["Unannotate",["b74"],["meta_schedule.cooperative_fetch"],[]],["GetLoops",["b74"],[],["l101","l102","l103","l104","l105","l106","l107"]],["Split",["l107","None",512,2],[1],["l108","l109","l110"]],["Vectorize",["l110"],[],[]],["Bind",["l109"],["threadIdx.x"],[]],["Unannotate",["b87"],["meta_schedule.cooperative_fetch"],[]],["GetLoops",["b87"],[],["l111","l112","l113","l114","l115","l116","l117"]],["Split",["l117","None",512,3],[1],["l118","l119","l120"]],["Vectorize",["l120"],[],[]],["Bind",["l119"],["threadIdx.x"],[]],["GetBlock",[],["root","main"],["b121"]],["Unannotate",["b121"],["meta_schedule.unroll_explicit"],[]],["GetChildBlocks",["b121"],[],["b122","b123","b124","b125"]],["GetLoops",["b122"],[],["l126","l127","l128","l129","l130","l131","l132","l133","l134"]],["GetLoops",["b123"],[],["l135","l136","l137","l138","l139","l140","l141","l142","l143"]],["GetLoops",["b124"],[],["l144","l145","l146","l147","l148","l149","l150","l151","l152","l153","l154","l155","l156","l157","l158","l159","l160","l161","l162","l163"]],["Annotate",["l144",512],["pragma_auto_unroll_max_step"],[]],["Annotate",["l144",1],["pragma_unroll_explicit"],[]],["GetLoops",["b125"],[],["l164","l165","l166","l167","l168","l169","l170"]],["GetBlock",[],["conv2d_nchw","main"],["b171"]],["GetLoops",["b171"],[],["l172","l173","l174","l175","l176","l177","l178","l179","l180","l181","l182","l183","l184","l185","l186","l187","l188","l189","l190","l191"]],["DecomposeReduction",["b171","l175"],[],["b192"]]],[[7,[2,1,1,1,1]],[9,[10,1,128,1,1]],[11,[2,1,4,2,1]],[13,[2,2,1,4,1]],[15,[320,4,1]],[17,[1,3,1]],[19,[1,1,3]],[36,1],[42,2],[47,3]]],[0.22401550000000000629],{"device":"mali","host":{"keys":["cpu"],"kind":"llvm","tag":""},"keys":["mali","opencl","gpu"],"kind":"opencl","max_function_args":128,"max_num_threads":1024,"max_shared_memory_per_block":32768,"max_threads_per_block":1024,"tag":"","texture_spatial_limit":16384,"thread_warp_size":16},[["TENSOR","float32",[2,1280,16,16]],["TENSOR","float32",[1280,1280,3,3]],["TENSOR","float32",[1,1280,1,1]],["TENSOR","float32",[2,1280,1,1]],["TENSOR","float32",[2,1280,16,16]]]]]
[7,[[[["GetBlock",[],["pad_temp","main"],["b0"]],["GetBlock",[],["conv2d_nchw","main"],["b1"]],["GetBlock",[],["T_add","main"],["b2"]],["GetBlock",[],["T_add_1","main"],["b3"]],["GetBlock",[],["T_divide","main"],["b4"]],["GetBlock",[],["root","main"],["b5"]],["Annotate",["b1","\"SSSRRSRS\""],["meta_schedule.tiling_structure"],[]],["GetLoops",["b1"],[],["l6","l7","l8","l9","l10","l11","l12"]],["SamplePerfectTile",["l6"],[5,64],["v13","v14","v15","v16","v17"]],["Split",["l6","v13","v14","v15","v16","v17"],[1],["l18","l19","l20","l21","l22"]],["SamplePerfectTile",["l7"],[5,64],["v23","v24","v25","v26","v27"]],["Split",["l7","v23","v24","v25","v26","v27"],[1],["l28","l29","l30","l31","l32"]],["SamplePerfectTile",["l8"],[5,64],["v33","v34","v35","v36","v37"]],["Split",["l8","v33","v34","v35","v36","v37"],[1],["l38","l39","l40","l41","l42"]],["SamplePerfectTile",["l9"],[5,64],["v43","v44","v45","v46","v47"]],["Split",["l9","v43","v44","v45","v46","v47"],[1],["l48","l49","l50","l51","l52"]],["SamplePerfectTile",["l10"],[3,64],["v53","v54","v55"]],["Split",["l10","v53","v54","v55"],[1],["l56","l57","l58"]],["SamplePerfectTile",["l11"],[3,64],["v59","v60","v61"]],["Split",["l11","v59","v60","v61"],[1],["l62","l63","l64"]],["SamplePerfectTile",["l12"],[3,64],["v65","v66","v67"]],["Split",["l12","v65","v66","v67"],[1],["l68","l69","l70"]],["Reorder",["l18","l28","l38","l48","l19","l29","l39","l49","l20","l30","l40","l50","l56","l62","l68","l57","l63","l69","l21","l31","l41","l51","l58","l64","l70","l22","l32","l42","l52"],[],[]],["Fuse",["l18","l28","l38","l48"],[1],["l71"]],["Bind",["l71"],["blockIdx.x"],[]],["Fuse",["l19","l29","l39","l49"],[1],["l72"]],["Bind",["l72"],["vthread.x"],[]],["Fuse",["l20","l30","l40","l50"],[1],["l73"]],["Bind",["l73"],["threadIdx.x"],[]],["Annotate",["b1",16],["meta_schedule.thread_extent_low_inclusive"],[]],["Annotate",["b1",1024],["meta_schedule.thread_extent_high_inclusive"],[]],["CacheWrite",["b1",[]],[0,"local"],["b74"]],["ReverseComputeAt",["b74","l73"],[1,-1],[]],["CacheRead",["b1",["b1"]],[0,"shared"],["b75"]],["ComputeAt",["b75","l68"],[1,-1],[]],["GetLoops",["b75"],[],["l76","l77","l78","l79","l80","l81","l82","l83","l84","l85"]],["Fuse",["l82","l83","l84","l85"],[1],["l86"]],["SampleCategorical",[],[[1,2,3,4],[0.25,0.25,0.25,0.25]],["v87"]],["Annotate",["b75","v87"],["meta_schedule.cooperative_fetch"],[]],["CacheRead",["b1",["b1"]],[1,"shared"],["b88"]],["ComputeAt",["b88","l68"],[1,-1],[]],["GetLoops",["b88"],[],["l89","l90","l91","l92","l93","l94","l95","l96","l97","l98"]],["Fuse",["l95","l96","l97","l98"],[1],["l99"]],["SampleCategorical",[],[[1,2,3,4],[0.25,0.25,0.25,0.25]],["v100"]],["Annotate",["b88","v100"],["meta_schedule.cooperative_fetch"],[]],["ReverseComputeInline",["b4"],[],[]],["ReverseComputeInline",["b3"],[],[]],["ReverseComputeInline",["b2"],[],[]],["ComputeInline",["b0"],[],[]],["SampleCategorical",[],[[0,16,64,512,1024],[0.2000000000000000111,0.2000000000000000111,0.2000000000000000111,0.2000000000000000111,0.2000000000000000111]],["v101"]],["Annotate",["b5","v101"],["meta_schedule.unroll_explicit"],[]],["EnterPostproc",[],[],[]],["Unannotate",["b75"],["meta_schedule.cooperative_fetch"],[]],["GetLoops",["b75"],[],["l102","l103","l104","l105","l106","l107","l108"]],["Split",["l108","None",128],[1],["l109","l110"]],["Bind",["l110"],["threadIdx.x"],[]],["Unannotate",["b88"],["meta_schedule.cooperative_fetch"],[]],["GetLoops",["b88"],[],["l111","l112","l113","l114","l115","l116","l117"]],["Split",["l117","None",128,3],[1],["l118","l119","l120"]],["Vectorize",["l120"],[],[]],["Bind",["l119"],["threadIdx.x"],[]],["GetBlock",[],["root","main"],["b121"]],["Unannotate",["b121"],["meta_schedule.unroll_explicit"],[]],["GetChildBlocks",["b121"],[],["b122","b123","b124","b125"]],["GetLoops",["b122"],[],["l126","l127","l128","l129","l130","l131","l132","l133"]],["GetLoops",["b123"],[],["l134","l135","l136","l137","l138","l139","l140","l141","l142"]],["GetLoops",["b124"],[],["l143","l144","l145","l146","l147","l148","l149","l150","l151","l152","l153","l154","l155","l156","l157","l158","l159","l160","l161","l162"]],["Annotate",["l143",1024],["pragma_auto_unroll_max_step"],[]],["Annotate",["l143",1],["pragma_unroll_explicit"],[]],["GetLoops",["b125"],[],["l163","l164","l165","l166","l167","l168","l169"]],["GetBlock",[],["conv2d_nchw","main"],["b170"]],["GetLoops",["b170"],[],["l171","l172","l173","l174","l175","l176","l177","l178","l179","l180","l181","l182","l183","l184","l185","l186","l187","l188","l189","l190"]],["DecomposeReduction",["b170","l174"],[],["b191"]]],[[8,[2,1,1,1,1]],[10,[160,1,4,2,1]],[12,[2,1,8,1,1]],[14,[2,1,4,1,2]],[16,[1280,1,1]],[18,[1,1,3]],[20,[1,3,1]],[37,2],[43,2],[49,4]]],[0.18588350299999997772],{"device":"mali","host":{"keys":["cpu"],"kind":"llvm","tag":""},"keys":["mali","opencl","gpu"],"kind":"opencl","max_function_args":128,"max_num_threads":1024,"max_shared_memory_per_block":32768,"max_threads_per_block":1024,"tag":"","texture_spatial_limit":16384,"thread_warp_size":16},[["TENSOR","float32",[2,1280,16,16]],["TENSOR","float32",[1280,1280,3,3]],["TENSOR","float32",[1,1280,1,1]],["TENSOR","float32",[2,1280,16,16]],["TENSOR","float32",[2,1280,16,16]]]]]
[8,[[[["GetBlock",[],["pad_temp","main"],["b0"]],["GetBlock",[],["conv2d_nchw","main"],["b1"]],["GetBlock",[],["T_add","main"],["b2"]],["GetBlock",[],["T_add_1","main"],["b3"]],["GetBlock",[],["root","main"],["b4"]],["Annotate",["b1","\"SSSRRSRS\""],["meta_schedule.tiling_structure"],[]],["GetLoops",["b1"],[],["l5","l6","l7","l8","l9","l10","l11"]],["SamplePerfectTile",["l5"],[5,64],["v12","v13","v14","v15","v16"]],["Split",["l5","v12","v13","v14","v15","v16"],[1],["l17","l18","l19","l20","l21"]],["SamplePerfectTile",["l6"],[5,64],["v22","v23","v24","v25","v26"]],["Split",["l6","v22","v23","v24","v25","v26"],[1],["l27","l28","l29","l30","l31"]],["SamplePerfectTile",["l7"],[5,64],["v32","v33","v34","v35","v36"]],["Split",["l7","v32","v33","v34","v35","v36"],[1],["l37","l38","l39","l40","l41"]],["SamplePerfectTile",["l8"],[5,64],["v42","v43","v44","v45","v46"]],["Split",["l8","v42","v43","v44","v45","v46"],[1],["l47","l48","l49","l50","l51"]],["SamplePerfectTile",["l9"],[3,64],["v52","v53","v54"]],["Split",["l9","v52","v53","v54"],[1],["l55","l56","l57"]],["SamplePerfectTile",["l10"],[3,64],["v58","v59","v60"]],["Split",["l10","v58","v59","v60"],[1],["l61","l62","l63"]],["SamplePerfectTile",["l11"],[3,64],["v64","v65","v66"]],["Split",["l11","v64","v65","v66"],[1],["l67","l68","l69"]],["Reorder",["l17","l27","l37","l47","l18","l28","l38","l48","l19","l29","l39","l49","l55","l61","l67","l56","l62","l68","l20","l30","l40","l50","l57","l63","l69","l21","l31","l41","l51"],[],[]],["Fuse",["l17","l27","l37","l47"],[1],["l70"]],["Bind",["l70"],["blockIdx.x"],[]],["Fuse",["l18","l28","l38","l48"],[1],["l71"]],["Bind",["l71"],["vthread.x"],[]],["Fuse",["l19","l29","l39","l49"],[1],["l72"]],["Bind",["l72"],["threadIdx.x"],[]],["Annotate",["b1",16],["meta_schedule.thread_extent_low_inclusive"],[]],["Annotate",["b1",1024],["meta_schedule.thread_extent_high_inclusive"],[]],["CacheWrite",["b1",[]],[0,"local"],["b73"]],["ReverseComputeAt",["b73","l72"],[1,-1],[]],["CacheRead",["b1",["b1"]],[0,"shared"],["b74"]],["ComputeAt",["b74","l67"],[1,-1],[]],["GetLoops",["b74"],[],["l75","l76","l77","l78","l79","l80","l81","l82","l83","l84"]],["Fuse",["l81","l82","l83","l84"],[1],["l85"]],["SampleCategorical",[],[[1,2,3,4],[0.25,0.25,0.25,0.25]],["v86"]],["Annotate",["b74","v86"],["meta_schedule.cooperative_fetch"],[]],["CacheRead",["b1",["b1"]],[1,"shared"],["b87"]],["ComputeAt",["b87","l67"],[1,-1],[]],["GetLoops",["b87"],[],["l88","l89","l90","l91","l92","l93","l94","l95","l96","l97"]],["Fuse",["l94","l95","l96","l97"],[1],["l98"]],["SampleCategorical",[],[[1,2,3,4],[0.25,0.25,0.25,0.25]],["v99"]],["Annotate",["b87","v99"],["meta_schedule.cooperative_fetch"],[]],["ReverseComputeInline",["b3"],[],[]],["ReverseComputeInline",["b2"],[],[]],["ComputeInline",["b0"],[],[]],["SampleCategorical",[],[[0,16,64,512,1024],[0.2000000000000000111,0.2000000000000000111,0.2000000000000000111,0.2000000000000000111,0.2000000000000000111]],["v100"]],["Annotate",["b4","v100"],["meta_schedule.unroll_explicit"],[]],["EnterPostproc",[],[],[]],["Unannotate",["b74"],["meta_schedule.cooperative_fetch"],[]],["GetLoops",["b74"],[],["l101","l102","l103","l104","l105","l106","l107"]],["Split",["l107","None",160],[1],["l108","l109"]],["Bind",["l109"],["threadIdx.x"],[]],["Unannotate",["b87"],["meta_schedule.cooperative_fetch"],[]],["GetLoops",["b87"],[],["l110","l111","l112","l113","l114","l115","l116"]],["Split",["l116","None",160],[1],["l117","l118"]],["Bind",["l118"],["threadIdx.x"],[]],["GetBlock",[],["root","main"],["b119"]],["Unannotate",["b119"],["meta_schedule.unroll_explicit"],[]],["GetChildBlocks",["b119"],[],["b120","b121","b122","b123"]],["GetLoops",["b120"],[],["l124","l125","l126","l127","l128","l129","l130","l131"]],["GetLoops",["b121"],[],["l132","l133","l134","l135","l136","l137","l138","l139"]],["GetLoops",["b122"],[],["l140","l141","l142","l143","l144","l145","l146","l147","l148","l149","l150","l151","l152","l153","l154","l155","l156","l157","l158","l159"]],["Annotate",["l140",64],["pragma_auto_unroll_max_step"],[]],["Annotate",["l140",1],["pragma_unroll_explicit"],[]],["GetLoops",["b123"],[],["l160","l161","l162","l163","l164","l165","l166"]],["GetBlock",[],["conv2d_nchw","main"],["b167"]],["GetLoops",["b167"],[],["l168","l169","l170","l171","l172","l173","l174","l175","l176","l177","l178","l179","l180","l181","l182","l183","l184","l185","l186","l187"]],["DecomposeReduction",["b167","l171"],[],["b188"]]],[[7,[2,1,1,1,1]],[9,[8,1,20,1,2]],[11,[8,1,2,1,4]],[13,[8,1,4,1,2]],[15,[320,1,1]],[17,[1,3,1]],[19,[1,3,1]],[36,2],[42,0],[47,2]]],[0.16609950000000001102],{"device":"mali","host":{"keys":["cpu"],"kind":"llvm","tag":""},"keys":["mali","opencl","gpu"],"kind":"opencl","max_function_args":128,"max_num_threads":1024,"max_shared_memory_per_block":32768,"max_threads_per_block":1024,"tag":"","texture_spatial_limit":16384,"thread_warp_size":16},[["TENSOR","float32",[2,320,64,64]],["TENSOR","float32",[320,320,3,3]],["TENSOR","float32",[1,320,1,1]],["TENSOR","float32",[2,320,1,1]],["TENSOR","float32",[2,320,64,64]]]]]
[9,[[[["GetBlock",[],["pad_temp","main"],["b0"]],["GetBlock",[],["conv2d_nchw","main"],["b1"]],["GetBlock",[],["T_add","main"],["b2"]],["GetBlock",[],["T_add_1","main"],["b3"]],["GetBlock",[],["root","main"],["b4"]],["Annotate",["b1","\"SSSRRSRS\""],["meta_schedule.tiling_structure"],[]],["GetLoops",["b1"],[],["l5","l6","l7","l8","l9","l10","l11"]],["SamplePerfectTile",["l5"],[5,64],["v12","v13","v14","v15","v16"]],["Split",["l5","v12","v13","v14","v15","v16"],[1],["l17","l18","l19","l20","l21"]],["SamplePerfectTile",["l6"],[5,64],["v22","v23","v24","v25","v26"]],["Split",["l6","v22","v23","v24","v25","v26"],[1],["l27","l28","l29","l30","l31"]],["SamplePerfectTile",["l7"],[5,64],["v32","v33","v34","v35","v36"]],["Split",["l7","v32","v33","v34","v35","v36"],[1],["l37","l38","l39","l40","l41"]],["SamplePerfectTile",["l8"],[5,64],["v42","v43","v44","v45","v46"]],["Split",["l8","v42","v43","v44","v45","v46"],[1],["l47","l48","l49","l50","l51"]],["SamplePerfectTile",["l9"],[3,64],["v52","v53","v54"]],["Split",["l9","v52","v53","v54"],[1],["l55","l56","l57"]],["SamplePerfectTile",["l10"],[3,64],["v58","v59","v60"]],["Split",["l10","v58","v59","v60"],[1],["l61","l62","l63"]],["SamplePerfectTile",["l11"],[3,64],["v64","v65","v66"]],["Split",["l11","v64","v65","v66"],[1],["l67","l68","l69"]],["Reorder",["l17","l27","l37","l47","l18","l28","l38","l48","l19","l29","l39","l49","l55","l61","l67","l56","l62","l68","l20","l30","l40","l50","l57","l63","l69","l21","l31","l41","l51"],[],[]],["Fuse",["l17","l27","l37","l47"],[1],["l70"]],["Bind",["l70"],["blockIdx.x"],[]],["Fuse",["l18","l28","l38","l48"],[1],["l71"]],["Bind",["l71"],["vthread.x"],[]],["Fuse",["l19","l29","l39","l49"],[1],["l72"]],["Bind",["l72"],["threadIdx.x"],[]],["Annotate",["b1",16],["meta_schedule.thread_extent_low_inclusive"],[]],["Annotate",["b1",1024],["meta_schedule.thread_extent_high_inclusive"],[]],["CacheWrite",["b1",[]],[0,"local"],["b73"]],["ReverseComputeAt",["b73","l72"],[1,-1],[]],["CacheRead",["b1",["b1"]],[0,"shared"],["b74"]],["ComputeAt",["b74","l67"],[1,-1],[]],["GetLoops",["b74"],[],["l75","l76","l77","l78","l79","l80","l81","l82","l83","l84"]],["Fuse",["l81","l82","l83","l84"],[1],["l85"]],["SampleCategorical",[],[[1,2,3,4],[0.25,0.25,0.25,0.25]],["v86"]],["Annotate",["b74","v86"],["meta_schedule.cooperative_fetch"],[]],["CacheRead",["b1",["b1"]],[1,"shared"],["b87"]],["ComputeAt",["b87","l67"],[1,-1],[]],["GetLoops",["b87"],[],["l88","l89","l90","l91","l92","l93","l94","l95","l96","l97"]],["Fuse",["l94","l95","l96","l97"],[1],["l98"]],["SampleCategorical",[],[[1,2,3,4],[0.25,0.25,0.25,0.25]],["v99"]],["Annotate",["b87","v99"],["meta_schedule.cooperative_fetch"],[]],["ReverseComputeInline",["b3"],[],[]],["ReverseComputeInline",["b2"],[],[]],["ComputeInline",["b0"],[],[]],["SampleCategorical",[],[[0,16,64,512,1024],[0.2000000000000000111,0.2000000000000000111,0.2000000000000000111,0.2000000000000000111,0.2000000000000000111]],["v100"]],["Annotate",["b4","v100"],["meta_schedule.unroll_explicit"],[]],["EnterPostproc",[],[],[]],["Unannotate",["b74"],["meta_schedule.cooperative_fetch"],[]],["GetLoops",["b74"],[],["l101","l102","l103","l104","l105","l106","l107"]],["Split",["l107","None",320,4],[1],["l108","l109","l110"]],["Vectorize",["l110"],[],[]],["Bind",["l109"],["threadIdx.x"],[]],["Unannotate",["b87"],["meta_schedule.cooperative_fetch"],[]],["GetLoops",["b87"],[],["l111","l112","l113","l114","l115","l116","l117"]],["Split",["l117","None",320,3],[1],["l118","l119","l120"]],["Vectorize",["l120"],[],[]],["Bind",["l119"],["threadIdx.x"],[]],["GetBlock",[],["root","main"],["b121"]],["Unannotate",["b121"],["meta_schedule.unroll_explicit"],[]],["GetChildBlocks",["b121"],[],["b122","b123","b124","b125"]],["GetLoops",["b122"],[],["l126","l127","l128","l129","l130","l131","l132","l133","l134"]],["GetLoops",["b123"],[],["l135","l136","l137","l138","l139","l140","l141","l142","l143"]],["GetLoops",["b124"],[],["l144","l145","l146","l147","l148","l149","l150","l151","l152","l153","l154","l155","l156","l157","l158","l159","l160","l161","l162","l163"]],["Annotate",["l144",64],["pragma_auto_unroll_max_step"],[]],["Annotate",["l144",1],["pragma_unroll_explicit"],[]],["GetLoops",["b125"],[],["l164","l165","l166","l167","l168","l169","l170"]],["GetBlock",[],["conv2d_nchw","main"],["b171"]],["GetLoops",["b171"],[],["l172","l173","l174","l175","l176","l177","l178","l179","l180","l181","l182","l183","l184","l185","l186","l187","l188","l189","l190","l191"]],["DecomposeReduction",["b171","l175"],[],["b192"]]],[[7,[1,1,2,1,1]],[9,[64,1,20,1,1]],[11,[1,2,2,1,2]],[13,[1,1,4,1,2]],[15,[512,1,5]],[17,[1,3,1]],[19,[1,1,3]],[36,3],[42,2],[47,2]]],[0.10835545700000000224],{"device":"mali","host":{"keys":["cpu"],"kind":"llvm","tag":""},"keys":["mali","opencl","gpu"],"kind":"opencl","max_function_args":128,"max_num_threads":1024,"max_shared_memory_per_block":32768,"max_threads_per_block":1024,"tag":"","texture_spatial_limit":16384,"thread_warp_size":16},[["TENSOR","float32",[2,2560,8,8]],["TENSOR","float32",[1280,2560,3,3]],["TENSOR","float32",[1,1280,1,1]],["TENSOR","float32",[2,1280,1,1]],["TENSOR","float32",[2,1280,8,8]]]]]
[10,[[[["GetBlock",[],["pad_temp","main"],["b0"]],["GetBlock",[],["conv2d_nchw","main"],["b1"]],["GetBlock",[],["T_add","main"],["b2"]],["GetBlock",[],["root","main"],["b3"]],["Annotate",["b1","\"SSSRRSRS\""],["meta_schedule.tiling_structure"],[]],["GetLoops",["b1"],[],["l4","l5","l6","l7","l8","l9","l10"]],["SamplePerfectTile",["l4"],[5,64],["v11","v12","v13","v14","v15"]],["Split",["l4","v11","v12","v13","v14","v15"],[1],["l16","l17","l18","l19","l20"]],["SamplePerfectTile",["l5"],[5,64],["v21","v22","v23","v24","v25"]],["Split",["l5","v21","v22","v23","v24","v25"],[1],["l26","l27","l28","l29","l30"]],["SamplePerfectTile",["l6"],[5,64],["v31","v32","v33","v34","v35"]],["Split",["l6","v31","v32","v33","v34","v35"],[1],["l36","l37","l38","l39","l40"]],["SamplePerfectTile",["l7"],[5,64],["v41","v42","v43","v44","v45"]],["Split",["l7","v41","v42","v43","v44","v45"],[1],["l46","l47","l48","l49","l50"]],["SamplePerfectTile",["l8"],[3,64],["v51","v52","v53"]],["Split",["l8","v51","v52","v53"],[1],["l54","l55","l56"]],["SamplePerfectTile",["l9"],[3,64],["v57","v58","v59"]],["Split",["l9","v57","v58","v59"],[1],["l60","l61","l62"]],["SamplePerfectTile",["l10"],[3,64],["v63","v64","v65"]],["Split",["l10","v63","v64","v65"],[1],["l66","l67","l68"]],["Reorder",["l16","l26","l36","l46","l17","l27","l37","l47","l18","l28","l38","l48","l54","l60","l66","l55","l61","l67","l19","l29","l39","l49","l56","l62","l68","l20","l30","l40","l50"],[],[]],["Fuse",["l16","l26","l36","l46"],[1],["l69"]],["Bind",["l69"],["blockIdx.x"],[]],["Fuse",["l17","l27","l37","l47"],[1],["l70"]],["Bind",["l70"],["vthread.x"],[]],["Fuse",["l18","l28","l38","l48"],[1],["l71"]],["Bind",["l71"],["threadIdx.x"],[]],["Annotate",["b1",16],["meta_schedule.thread_extent_low_inclusive"],[]],["Annotate",["b1",1024],["meta_schedule.thread_extent_high_inclusive"],[]],["CacheWrite",["b1",[]],[0,"local"],["b72"]],["ReverseComputeAt",["b72","l71"],[1,-1],[]],["CacheRead",["b1",["b1"]],[0,"shared"],["b73"]],["ComputeAt",["b73","l66"],[1,-1],[]],["GetLoops",["b73"],[],["l74","l75","l76","l77","l78","l79","l80","l81","l82","l83"]],["Fuse",["l80","l81","l82","l83"],[1],["l84"]],["SampleCategorical",[],[[1,2,3,4],[0.25,0.25,0.25,0.25]],["v85"]],["Annotate",["b73","v85"],["meta_schedule.cooperative_fetch"],[]],["CacheRead",["b1",["b1"]],[1,"shared"],["b86"]],["ComputeAt",["b86","l66"],[1,-1],[]],["GetLoops",["b86"],[],["l87","l88","l89","l90","l91","l92","l93","l94","l95","l96"]],["Fuse",["l93","l94","l95","l96"],[1],["l97"]],["SampleCategorical",[],[[1,2,3,4],[0.25,0.25,0.25,0.25]],["v98"]],["Annotate",["b86","v98"],["meta_schedule.cooperative_fetch"],[]],["ReverseComputeInline",["b2"],[],[]],["ComputeInline",["b0"],[],[]],["SampleCategorical",[],[[0,16,64,512,1024],[0.2000000000000000111,0.2000000000000000111,0.2000000000000000111,0.2000000000000000111,0.2000000000000000111]],["v99"]],["Annotate",["b3","v99"],["meta_schedule.unroll_explicit"],[]],["EnterPostproc",[],[],[]],["Unannotate",["b73"],["meta_schedule.cooperative_fetch"],[]],["GetLoops",["b73"],[],["l100","l101","l102","l103","l104","l105","l106"]],["Split",["l106","None",64],[1],["l107","l108"]],["Bind",["l108"],["threadIdx.x"],[]],["Unannotate",["b86"],["meta_schedule.cooperative_fetch"],[]],["GetLoops",["b86"],[],["l109","l110","l111","l112","l113","l114","l115"]],["Split",["l115","None",64,3],[1],["l116","l117","l118"]],["Vectorize",["l118"],[],[]],["Bind",["l117"],["threadIdx.x"],[]],["GetBlock",[],["root","main"],["b119"]],["Unannotate",["b119"],["meta_schedule.unroll_explicit"],[]],["GetChildBlocks",["b119"],[],["b120","b121","b122","b123"]],["GetLoops",["b120"],[],["l124","l125","l126","l127","l128","l129","l130","l131"]],["GetLoops",["b121"],[],["l132","l133","l134","l135","l136","l137","l138","l139","l140"]],["GetLoops",["b122"],[],["l141","l142","l143","l144","l145","l146","l147","l148","l149","l150","l151","l152","l153","l154","l155","l156","l157","l158","l159","l160"]],["Annotate",["l141",64],["pragma_auto_unroll_max_step"],[]],["Annotate",["l141",1],["pragma_unroll_explicit"],[]],["GetLoops",["b123"],[],["l161","l162","l163","l164","l165","l166","l167"]],["GetBlock",[],["conv2d_nchw","main"],["b168"]],["GetLoops",["b168"],[],["l169","l170","l171","l172","l173","l174","l175","l176","l177","l178","l179","l180","l181","l182","l183","l184","l185","l186","l187","l188"]],["DecomposeReduction",["b168","l172"],[],["b189"]]],[[6,[2,1,1,1,1]],[8,[2,1,32,5,1]],[10,[4,2,2,1,2]],[12,[8,1,1,1,4]],[14,[160,1,2]],[16,[1,1,3]],[18,[1,1,3]],[35,3],[41,2],[45,2]]],[0.10443495900000000776],{"device":"mali","host":{"keys":["cpu"],"kind":"llvm","tag":""},"keys":["mali","opencl","gpu"],"kind":"opencl","max_function_args":128,"max_num_threads":1024,"max_shared_memory_per_block":32768,"max_threads_per_block":1024,"tag":"","texture_spatial_limit":16384,"thread_warp_size":16},[["TENSOR","float32",[2,320,64,64]],["TENSOR","float32",[320,320,3,3]],["TENSOR","float32",[1,320,1,1]],["TENSOR","float32",[2,320,32,32]]]]]
[11,[[[["GetBlock",[],["pad_temp","main"],["b0"]],["GetBlock",[],["conv2d_nchw","main"],["b1"]],["GetBlock",[],["T_add","main"],["b2"]],["GetBlock",[],["T_add_1","main"],["b3"]],["GetBlock",[],["root","main"],["b4"]],["Annotate",["b1","\"SSSRRSRS\""],["meta_schedule.tiling_structure"],[]],["GetLoops",["b1"],[],["l5","l6","l7","l8","l9","l10","l11"]],["SamplePerfectTile",["l5"],[5,64],["v12","v13","v14","v15","v16"]],["Split",["l5","v12","v13","v14","v15","v16"],[1],["l17","l18","l19","l20","l21"]],["SamplePerfectTile",["l6"],[5,64],["v22","v23","v24","v25","v26"]],["Split",["l6","v22","v23","v24","v25","v26"],[1],["l27","l28","l29","l30","l31"]],["SamplePerfectTile",["l7"],[5,64],["v32","v33","v34","v35","v36"]],["Split",["l7","v32","v33","v34","v35","v36"],[1],["l37","l38","l39","l40","l41"]],["SamplePerfectTile",["l8"],[5,64],["v42","v43","v44","v45","v46"]],["Split",["l8","v42","v43","v44","v45","v46"],[1],["l47","l48","l49","l50","l51"]],["SamplePerfectTile",["l9"],[3,64],["v52","v53","v54"]],["Split",["l9","v52","v53","v54"],[1],["l55","l56","l57"]],["SamplePerfectTile",["l10"],[3,64],["v58","v59","v60"]],["Split",["l10","v58","v59","v60"],[1],["l61","l62","l63"]],["SamplePerfectTile",["l11"],[3,64],["v64","v65","v66"]],["Split",["l11","v64","v65","v66"],[1],["l67","l68","l69"]],["Reorder",["l17","l27","l37","l47","l18","l28","l38","l48","l19","l29","l39","l49","l55","l61","l67","l56","l62","l68","l20","l30","l40","l50","l57","l63","l69","l21","l31","l41","l51"],[],[]],["Fuse",["l17","l27","l37","l47"],[1],["l70"]],["Bind",["l70"],["blockIdx.x"],[]],["Fuse",["l18","l28","l38","l48"],[1],["l71"]],["Bind",["l71"],["vthread.x"],[]],["Fuse",["l19","l29","l39","l49"],[1],["l72"]],["Bind",["l72"],["threadIdx.x"],[]],["Annotate",["b1",16],["meta_schedule.thread_extent_low_inclusive"],[]],["Annotate",["b1",1024],["meta_schedule.thread_extent_high_inclusive"],[]],["CacheWrite",["b1",[]],[0,"local"],["b73"]],["ReverseComputeAt",["b73","l72"],[1,-1],[]],["CacheRead",["b1",["b1"]],[0,"shared"],["b74"]],["ComputeAt",["b74","l67"],[1,-1],[]],["GetLoops",["b74"],[],["l75","l76","l77","l78","l79","l80","l81","l82","l83","l84"]],["Fuse",["l81","l82","l83","l84"],[1],["l85"]],["SampleCategorical",[],[[1,2,3,4],[0.25,0.25,0.25,0.25]],["v86"]],["Annotate",["b74","v86"],["meta_schedule.cooperative_fetch"],[]],["CacheRead",["b1",["b1"]],[1,"shared"],["b87"]],["ComputeAt",["b87","l67"],[1,-1],[]],["GetLoops",["b87"],[],["l88","l89","l90","l91","l92","l93","l94","l95","l96","l97"]],["Fuse",["l94","l95","l96","l97"],[1],["l98"]],["SampleCategorical",[],[[1,2,3,4],[0.25,0.25,0.25,0.25]],["v99"]],["Annotate",["b87","v99"],["meta_schedule.cooperative_fetch"],[]],["ReverseComputeInline",["b3"],[],[]],["ReverseComputeInline",["b2"],[],[]],["ComputeInline",["b0"],[],[]],["SampleCategorical",[],[[0,16,64,512,1024],[0.2000000000000000111,0.2000000000000000111,0.2000000000000000111,0.2000000000000000111,0.2000000000000000111]],["v100"]],["Annotate",["b4","v100"],["meta_schedule.unroll_explicit"],[]],["EnterPostproc",[],[],[]],["Unannotate",["b74"],["meta_schedule.cooperative_fetch"],[]],["GetLoops",["b74"],[],["l101","l102","l103","l104","l105","l106","l107"]],["Split",["l107","None",160,2],[1],["l108","l109","l110"]],["Vectorize",["l110"],[],[]],["Bind",["l109"],["threadIdx.x"],[]],["Unannotate",["b87"],["meta_schedule.cooperative_fetch"],[]],["GetLoops",["b87"],[],["l111","l112","l113","l114","l115","l116","l117"]],["Split",["l117","None",160],[1],["l118","l119"]],["Bind",["l119"],["threadIdx.x"],[]],["GetBlock",[],["root","main"],["b120"]],["Unannotate",["b120"],["meta_schedule.unroll_explicit"],[]],["GetChildBlocks",["b120"],[],["b121","b122","b123","b124"]],["GetLoops",["b121"],[],["l125","l126","l127","l128","l129","l130","l131","l132","l133"]],["GetLoops",["b122"],[],["l134","l135","l136","l137","l138","l139","l140","l141"]],["GetLoops",["b123"],[],["l142","l143","l144","l145","l146","l147","l148","l149","l150","l151","l152","l153","l154","l155","l156","l157","l158","l159","l160","l161"]],["Annotate",["l142",16],["pragma_auto_unroll_max_step"],[]],["Annotate",["l142",1],["pragma_unroll_explicit"],[]],["GetLoops",["b124"],[],["l162","l163","l164","l165","l166","l167","l168"]],["GetBlock",[],["conv2d_nchw","main"],["b169"]],["GetLoops",["b169"],[],["l170","l171","l172","l173","l174","l175","l176","l177","l178","l179","l180","l181","l182","l183","l184","l185","l186","l187","l188","l189"]],["DecomposeReduction",["b169","l173"],[],["b190"]]],[[7,[2,1,1,1,1]],[9,[128,1,5,1,1]],[11,[1,1,16,1,2]],[13,[8,1,2,2,1]],[15,[960,1,1]],[17,[1,3,1]],[19,[1,3,1]],[36,1],[42,3],[47,1]]],[0.3752968899999999941],{"device":"mali","host":{"keys":["cpu"],"kind":"llvm","tag":""},"keys":["mali","opencl","gpu"],"kind":"opencl","max_function_args":128,"max_num_threads":1024,"max_shared_memory_per_block":32768,"max_threads_per_block":1024,"tag":"","texture_spatial_limit":16384,"thread_warp_size":16},[["TENSOR","float32",[2,960,32,32]],["TENSOR","float32",[640,960,3,3]],["TENSOR","float32",[1,640,1,1]],["TENSOR","float32",[2,640,1,1]],["TENSOR","float32",[2,640,32,32]]]]]
